{
  "$schema": "https://json-schema.org/draft/2020-12/schema",
  "$id": "https://fraud-scoring-service.local/schemas/events/transaction.json",
  "title": "fraud.event.transaction.v1",
  "type": "object",
  "additionalProperties": false,
  "required": [
    "schema",
    "event_id",
    "transaction_id",
    "account_id",
    "amount_minor",
    "currency",
    "merchant_id",
    "mcc",
    "channel",
    "device_id",
    "ip_prefix",
    "country",
    "event_ts"
  ],
  "properties": {
    "schema": {
      "const": "fraud.event.transaction.v1"
    },
    "event_id": {
      "type": "string",
      "pattern": "^[0-9a-f]{8}-[0-9a-f]{4}-[0-9a-f]{4}-[0-9a-f]{4}-[0-9a-f]{12}$"
    },
    "transaction_id": {
      "type": "string",
      "pattern": "^[0-9a-f]{8}-[0-9a-f]{4}-[0-9a-f]{4}-[0-9a-f]{4}-[0-9a-f]{12}$"
    },
    "account_id": {
      "type": "string",
      "pattern": "^acc_[0-9a-z]{6,32}$"
    },
    "amount_minor": {
      "type": "integer",
      "minimum": 1,
      "maximum": 10000000
    },
    "currency": {
      "enum": [
        "USD",
        "EUR",
        "GBP",
        "CAD",
        "AUD",
        "JPY",
        "CHF",
        "SEK",
        "NOK",
        "DKK",
        "PLN",
        "MXN",
        "BRL",
        "SGD",
        "NZD"
      ]
    },
    "merchant_id": {
      "type": "string",
      "pattern": "^m_[0-9a-z]{4,32}$"
    },
    "merchant_name": {
      "type": "string",
      "maxLength": 120,
      "description": "synthetic display name; untrusted text, never used for scoring",
      "pattern": "^[^\\x00-\\x1f\\x7f]*$"
    },
    "mcc": {
      "enum": [
        "4111",
        "4511",
        "4816",
        "4829",
        "5311",
        "5399",
        "5411",
        "5541",
        "5651",
        "5732",
        "5812",
        "5814",
        "5815",
        "5816",
        "5912",
        "5944",
        "5999",
        "7011",
        "7995"
      ],
      "description": "ISO 18245 merchant category code; allowlist = the synthetic catalog (cmd/gen, D-051)"
    },
    "channel": {
      "enum": [
        "CARD_PRESENT",
        "ECOMMERCE",
        "P2P"
      ]
    },
    "device_id": {
      "type": "string",
      "pattern": "^[0-9a-f]{64}$",
      "description": "salted SHA-256 of the device identifier"
    },
    "ip_prefix": {
      "type": "string",
      "pattern": "^(25[0-5]|2[0-4]\\d|1?\\d?\\d)\\.(25[0-5]|2[0-4]\\d|1?\\d?\\d)\\.(25[0-5]|2[0-4]\\d|1?\\d?\\d)\\.0/24$",
      "description": "IPv4 /24 prefix only"
    },
    "country": {
      "type": "string",
      "pattern": "^[A-Z]{2}$"
    },
    "event_ts": {
      "type": "string",
      "pattern": "^\\d{4}-\\d{2}-\\d{2}T\\d{2}:\\d{2}:\\d{2}(\\.\\d{1,9})?(Z|[+-]\\d{2}:\\d{2})$"
    }
  }
}
